{
  "title": "FIXTURE: line - dates - min max - missing values",
  "data": [
    [
      "Date",
      "Investment Grade",
      "High Yield"
    ],
    [
      "10.01.2018",
      "101.5506",
      "105.9014"
    ],
    [
      "11.01.2018",
      "101.2484",
      "105.7281"
    ],
    [
      "12.01.2018",
      "101.3403",
      "105.8209"
    ],
    [
      "15.01.2018",
      "101.3149",
      "105.8688"
    ],
    [
      "16.01.2018",
      "101.5181",
      "106.0096"
    ],
    [
      "17.01.2018",
      "101.6027",
      "106.0699"
    ],
    [
      "18.01.2018",
      "101.5611",
      "90"
    ],
    [
      "19.01.2018",
      "101.5764",
      "106.1828"
    ],
    [
      "22.01.2018",
      "101.7323",
      "106.3613"
    ],
    [
      "23.01.2018",
      "101.7856",
      "106.4471"
    ],
    [
      "24.01.2018",
      "101.7483",
      null
    ],
    [
      "25.01.2018",
      "101.5938",
      "106.5816"
    ],
    [
      "26.01.2018",
      "101.4722",
      "106.3806"
    ]
  ],
  "sources": [],
  "options": {
    "chartType": "Line",
    "hideAxisLabel": false,
    "barOptions": {
      "isBarChart": false,
      "forceBarsOnSmall": false
    },
    "dateSeriesOptions": {
      "interval": "day",
      "prognosisStart": 6
    },
    "lineChartOptions": {
      "reverseYScale": false,
      "lineInterpolation": "linear",
      "minValue": 90,
      "maxValue": 110
    },
    "highlightDataSeries": [],
    "colorOverwritesSeries": []
  }
}